{
  "scenario_id": "vk_runtime_success_v1",
  "provider": "vk",
  "kind": "runtime_success",
  "source": {
    "kind": "fixture_replay",
    "captured_at": "2026-04-03",
    "legacy_reference": "test/compatibility/vk/fixtures/vk_call_debug_success_v1.json; /home/egor/code/vk-turn-proxy/client/main.go:getVkCreds,oneTurnConnection,oneDtlsConnection",
    "rewrite_reference": "test/compatibility/vk/runtime/replay_test.go:TestRuntimeEvidenceReplay; cmd/tunnel-client/main.go:runClient"
  },
  "replay": {
    "provider_fixture": "vk_call_debug_success_v1.json"
  },
  "slice": {
    "connections": 1,
    "dtls": true,
    "mode": "udp",
    "bind_interface": ""
  },
  "input": {
    "invite_redacted": "https://vk.com/call/join/<redacted:vk-join-token>",
    "peer_addr_redacted": "<runtime:turnlab-peer>",
    "turn_override": "<runtime:turnlab-host>",
    "port_override": "<runtime:turnlab-port>"
  },
  "legacy": {
    "result": "success",
    "exit_code": 0,
    "error_stage": "",
    "forwarding_round_trip": true,
    "notes": [
      "Provider resolution for this scenario is anchored by vk_call_debug_success_v1, which preserves the legacy getVkCreds four-stage VK/OK flow and normalized TURN address.",
      "The legacy runtime oracle for the supported slice is the single-session path getVkCreds -> oneTurnConnection -> oneDtlsConnection with turn and peer overrides materialized from the replay placeholders below; expected outcome is exit_code=0 with a completed UDP round trip."
    ]
  },
  "rewrite": {
    "result": "success",
    "exit_code": 0,
    "error_stage": "",
    "forwarding_round_trip": true,
    "notes": [
      "The rewrite success path is replayed deterministically by TestRuntimeEvidenceReplay using provider=vk, fixture-driven staged HTTP resolution, and a turnlab DTLS peer.",
      "cmd/tunnel-client/main.go returns exit code 0 when session.Run completes without error."
    ]
  },
  "deviations": []
}
